{
  "eventId": "44444444-4444-4444-8444-444444444444",
  "eventType": "JobRequested",
  "schemaVersion": 1,
  "occurredAt": "2026-10-04T00:00:00Z",
  "producer": "processing-service",
  "traceId": "11111111111111111111111111111111",
  "payload": {
    "jobId": "44444444-4444-4444-8444-444444444444",
    "documentId": "11111111-1111-4111-8111-111111111111",
    "revision": 1
  }
}
